{
  "question": "How should the RAC system be connected to the existing memory layer?",
  "question_type": "technical_design",
  "domain": "ai_system_design",
  "factors": [
    {
      "factor_id": "typed_memory",
      "name": "Typed memory",
      "description": "Preserve existing typed facts.",
      "evidence_needed": [
        "memory schema"
      ]
    },
    {
      "factor_id": "evidence_packets",
      "name": "Evidence packets",
      "description": "Pass structured evidence rather than free-form context.",
      "evidence_needed": [
        "source path",
        "claim supported",
        "limitations"
      ]
    },
    {
      "factor_id": "hypotheses",
      "name": "Hypotheses",
      "description": "Preserve competing explanations before final synthesis.",
      "evidence_needed": [
        "hypothesis records"
      ]
    },
    {
      "factor_id": "belief_records",
      "name": "Belief records",
      "description": "Store conclusions with confidence and validity conditions.",
      "evidence_needed": [
        "belief update schema"
      ]
    },
    {
      "factor_id": "confidence",
      "name": "Confidence",
      "description": "Expose uncertainty explicitly.",
      "evidence_needed": [
        "confidence field"
      ]
    },
    {
      "factor_id": "limitations",
      "name": "Limitations",
      "description": "State what cannot be concluded.",
      "evidence_needed": [
        "limitations field"
      ]
    },
    {
      "factor_id": "retrieval_trace",
      "name": "Retrieval trace",
      "description": "Make evidence traceable to sources.",
      "evidence_needed": [
        "source metadata"
      ]
    },
    {
      "factor_id": "active_state_filtering",
      "name": "Active-state filtering",
      "description": "Avoid stale or deprecated memory records.",
      "evidence_needed": [
        "active flag",
        "freshness policy"
      ]
    }
  ],
  "factor_weights": [
    {
      "factor_id": "typed_memory",
      "weight": 0.72,
      "weight_bucket": "medium",
      "weight_reason": "Important context but not sufficient on its own.",
      "weighting_method": "deterministic heuristic bucket assignment in rac/src/mock_pipeline.py; not learned from data, not calculated directly from observed metric tables, not a probability, and not an optimized business threshold",
      "weight_source": "rac/src/mock_pipeline.py",
      "evidence_status": "partially_supported"
    },
    {
      "factor_id": "evidence_packets",
      "weight": 0.85,
      "weight_bucket": "high",
      "weight_reason": "Central to avoiding overconfident or misleading conclusions.",
      "weighting_method": "deterministic heuristic bucket assignment in rac/src/mock_pipeline.py; not learned from data, not calculated directly from observed metric tables, not a probability, and not an optimized business threshold",
      "weight_source": "rac/src/mock_pipeline.py",
      "evidence_status": "partially_supported"
    },
    {
      "factor_id": "hypotheses",
      "weight": 0.72,
      "weight_bucket": "medium",
      "weight_reason": "Important context but not sufficient on its own.",
      "weighting_method": "deterministic heuristic bucket assignment in rac/src/mock_pipeline.py; not learned from data, not calculated directly from observed metric tables, not a probability, and not an optimized business threshold",
      "weight_source": "rac/src/mock_pipeline.py",
      "evidence_status": "partially_supported"
    },
    {
      "factor_id": "belief_records",
      "weight": 0.85,
      "weight_bucket": "high",
      "weight_reason": "Central to avoiding overconfident or misleading conclusions.",
      "weighting_method": "deterministic heuristic bucket assignment in rac/src/mock_pipeline.py; not learned from data, not calculated directly from observed metric tables, not a probability, and not an optimized business threshold",
      "weight_source": "rac/src/mock_pipeline.py",
      "evidence_status": "partially_supported"
    },
    {
      "factor_id": "confidence",
      "weight": 0.72,
      "weight_bucket": "medium",
      "weight_reason": "Important context but not sufficient on its own.",
      "weighting_method": "deterministic heuristic bucket assignment in rac/src/mock_pipeline.py; not learned from data, not calculated directly from observed metric tables, not a probability, and not an optimized business threshold",
      "weight_source": "rac/src/mock_pipeline.py",
      "evidence_status": "partially_supported"
    },
    {
      "factor_id": "limitations",
      "weight": 0.72,
      "weight_bucket": "medium",
      "weight_reason": "Important context but not sufficient on its own.",
      "weighting_method": "deterministic heuristic bucket assignment in rac/src/mock_pipeline.py; not learned from data, not calculated directly from observed metric tables, not a probability, and not an optimized business threshold",
      "weight_source": "rac/src/mock_pipeline.py",
      "evidence_status": "partially_supported"
    },
    {
      "factor_id": "retrieval_trace",
      "weight": 0.85,
      "weight_bucket": "high",
      "weight_reason": "Central to avoiding overconfident or misleading conclusions.",
      "weighting_method": "deterministic heuristic bucket assignment in rac/src/mock_pipeline.py; not learned from data, not calculated directly from observed metric tables, not a probability, and not an optimized business threshold",
      "weight_source": "rac/src/mock_pipeline.py",
      "evidence_status": "partially_supported"
    },
    {
      "factor_id": "active_state_filtering",
      "weight": 0.72,
      "weight_bucket": "medium",
      "weight_reason": "Important context but not sufficient on its own.",
      "weighting_method": "deterministic heuristic bucket assignment in rac/src/mock_pipeline.py; not learned from data, not calculated directly from observed metric tables, not a probability, and not an optimized business threshold",
      "weight_source": "rac/src/mock_pipeline.py",
      "evidence_status": "partially_supported"
    }
  ],
  "evidence_packets": [
    {
      "evidence_id": "evidence_typed_memory",
      "source_type": "markdown",
      "source_path": "rac/README.md",
      "claim_supported": "Provides context needed to evaluate factor: typed_memory.",
      "limitations": [
        "Deterministic mock pipeline only.",
        "No live retrieval is performed in this step."
      ]
    },
    {
      "evidence_id": "evidence_evidence_packets",
      "source_type": "markdown",
      "source_path": "rac/README.md",
      "claim_supported": "Provides context needed to evaluate factor: evidence_packets.",
      "limitations": [
        "Deterministic mock pipeline only.",
        "No live retrieval is performed in this step."
      ]
    },
    {
      "evidence_id": "evidence_hypotheses",
      "source_type": "markdown",
      "source_path": "rac/README.md",
      "claim_supported": "Provides context needed to evaluate factor: hypotheses.",
      "limitations": [
        "Deterministic mock pipeline only.",
        "No live retrieval is performed in this step."
      ]
    },
    {
      "evidence_id": "evidence_belief_records",
      "source_type": "markdown",
      "source_path": "rac/README.md",
      "claim_supported": "Provides context needed to evaluate factor: belief_records.",
      "limitations": [
        "Deterministic mock pipeline only.",
        "No live retrieval is performed in this step."
      ]
    },
    {
      "evidence_id": "evidence_confidence",
      "source_type": "markdown",
      "source_path": "rac/README.md",
      "claim_supported": "Provides context needed to evaluate factor: confidence.",
      "limitations": [
        "Deterministic mock pipeline only.",
        "No live retrieval is performed in this step."
      ]
    },
    {
      "evidence_id": "evidence_limitations",
      "source_type": "markdown",
      "source_path": "rac/README.md",
      "claim_supported": "Provides context needed to evaluate factor: limitations.",
      "limitations": [
        "Deterministic mock pipeline only.",
        "No live retrieval is performed in this step."
      ]
    },
    {
      "evidence_id": "evidence_retrieval_trace",
      "source_type": "markdown",
      "source_path": "rac/README.md",
      "claim_supported": "Provides context needed to evaluate factor: retrieval_trace.",
      "limitations": [
        "Deterministic mock pipeline only.",
        "No live retrieval is performed in this step."
      ]
    },
    {
      "evidence_id": "evidence_active_state_filtering",
      "source_type": "markdown",
      "source_path": "rac/README.md",
      "claim_supported": "Provides context needed to evaluate factor: active_state_filtering.",
      "limitations": [
        "Deterministic mock pipeline only.",
        "No live retrieval is performed in this step."
      ]
    }
  ],
  "hypotheses": [
    {
      "hypothesis_id": "H1",
      "claim": "RAC should be implemented as a reasoning layer above the existing typed memory layer.",
      "confidence": 0.86,
      "supporting_factors": [
        "typed_memory",
        "evidence_packets",
        "hypotheses",
        "belief_records",
        "retrieval_trace",
        "active_state_filtering"
      ],
      "weaknesses": [
        "This mock pipeline does not call the existing API or vector database."
      ],
      "status": "strong"
    },
    {
      "hypothesis_id": "H2",
      "claim": "The first implementation should remain deterministic before adding LLM calls.",
      "confidence": 0.8,
      "supporting_factors": [
        "confidence",
        "limitations",
        "retrieval_trace"
      ],
      "weaknesses": [
        "Deterministic logic is less flexible than model-based reasoning."
      ],
      "status": "strong"
    }
  ],
  "critic_findings": [
    {
      "issue": "The mock pipeline must not claim causal proof from observational evidence.",